{
  "$schema": "http://json-schema.org/draft-04/schema#",
  "id": "absorbed_dose",
  "title": "Absorbed Dose",
  "type": "object",
  "namespace": "urn:nmmi:lu177-psma:model",
  "category": "clinical",
  "program": "*",
  "project": "*",
  "description": "One absorbed-dose result for a target from a dosimetry run.",
  "additionalProperties": false,
  "submittable": true,
  "validators": null,
  "links": [
    {
      "name": "dosimetries",
      "backref": "nmmi_absorbed_dose_dosimetries",
      "label": "related_to",
      "target_type": "dosimetry",
      "multiplicity": "many_to_one",
      "required": true
    },
    {
      "name": "anatomic_targets",
      "backref": "nmmi_absorbed_dose_anatomic_targets",
      "label": "related_to",
      "target_type": "anatomic_target",
      "multiplicity": "many_to_one",
      "required": true
    },
    {
      "name": "provenance_records",
      "backref": "nmmi_absorbed_dose_provenance_records",
      "label": "documented_by",
      "target_type": "provenance",
      "multiplicity": "many_to_many",
      "required": false
    },
    {
      "name": "annotations",
      "target_type": "annotation",
      "backref": "nmmi_absorbed_dose_annotations",
      "label": "related_to",
      "multiplicity": "many_to_many",
      "required": false
    }
  ],
  "required": [
    "type",
    "submitter_id",
    "dosimetries",
    "anatomic_targets",
    "absorbed_dose_gy",
    "statistic"
  ],
  "uniqueKeys": [
    [
      "id"
    ],
    [
      "project_id",
      "submitter_id"
    ]
  ],
  "systemProperties": [
    "id",
    "project_id",
    "state",
    "created_datetime",
    "updated_datetime"
  ],
  "properties": {
    "type": {
      "enum": [
        "absorbed_dose"
      ]
    },
    "submitter_id": {
      "type": "string",
      "description": "Stable submitter-assigned identifier, unique within a project. Do not encode direct patient identifiers.",
      "minLength": 1
    },
    "id": {
      "pattern": "^[a-fA-F0-9]{8}-[a-fA-F0-9]{4}-[a-fA-F0-9]{4}-[a-fA-F0-9]{4}-[a-fA-F0-9]{12}$",
      "systemAlias": "node_id",
      "term": {
        "description": "A 128-bit identifier. Depending on the mechanism used to generate it, it is either guaranteed to be different from all other UUIDs/GUIDs generated until 3400 AD or extremely likely to be different. Its relatively small size lends itself well to sorting, ordering, and hashing of all sorts, storing in databases, simple allocation, and ease of programming in general.\n",
        "termDef": {
          "cde_id": "C54100",
          "cde_version": null,
          "source": "NCIt",
          "term": "Universally Unique Identifier",
          "term_url": "https://ncit.nci.nih.gov/ncitbrowser/ConceptReport.jsp?dictionary=NCI_Thesaurus&version=16.02d&ns=NCI_Thesaurus&code=C54100"
        }
      },
      "type": "string"
    },
    "project_id": {
      "term": {
        "description": "Unique ID for any specific defined piece of work that is undertaken or attempted to meet a single requirement.\n"
      },
      "type": "string"
    },
    "state": {
      "default": "validated",
      "downloadable": [
        "uploaded",
        "md5summed",
        "validating",
        "validated",
        "error",
        "invalid",
        "released"
      ],
      "oneOf": [
        {
          "enum": [
            "uploading",
            "uploaded",
            "md5summing",
            "md5summed",
            "validating",
            "error",
            "invalid",
            "suppressed",
            "redacted",
            "live"
          ]
        },
        {
          "enum": [
            "validated",
            "submitted",
            "released"
          ]
        }
      ],
      "public": [
        "live"
      ],
      "term": {
        "description": "The current state of the object.\n"
      }
    },
    "created_datetime": {
      "oneOf": [
        {
          "format": "date-time",
          "type": "string"
        },
        {
          "type": "null"
        }
      ],
      "term": {
        "description": "A combination of date and time of day in the form [-]CCYY-MM-DDThh:mm:ss[Z|(+|-)hh:mm]\n"
      }
    },
    "updated_datetime": {
      "oneOf": [
        {
          "format": "date-time",
          "type": "string"
        },
        {
          "type": "null"
        }
      ],
      "term": {
        "description": "A combination of date and time of day in the form [-]CCYY-MM-DDThh:mm:ss[Z|(+|-)hh:mm]\n"
      }
    },
    "dosimetries": {
      "type": "array",
      "items": {
        "type": "object",
        "additionalProperties": false,
        "properties": {
          "submitter_id": {
            "type": "string",
            "minLength": 1
          },
          "id": {
            "pattern": "^[a-fA-F0-9]{8}-[a-fA-F0-9]{4}-[a-fA-F0-9]{4}-[a-fA-F0-9]{4}-[a-fA-F0-9]{12}$",
            "term": {
              "description": "A 128-bit identifier. Depending on the mechanism used to generate it, it is either guaranteed to be different from all other UUIDs/GUIDs generated until 3400 AD or extremely likely to be different. Its relatively small size lends itself well to sorting, ordering, and hashing of all sorts, storing in databases, simple allocation, and ease of programming in general.\n",
              "termDef": {
                "cde_id": "C54100",
                "cde_version": null,
                "source": "NCIt",
                "term": "Universally Unique Identifier",
                "term_url": "https://ncit.nci.nih.gov/ncitbrowser/ConceptReport.jsp?dictionary=NCI_Thesaurus&version=16.02d&ns=NCI_Thesaurus&code=C54100"
              }
            },
            "type": "string"
          }
        },
        "oneOf": [
          {
            "required": [
              "submitter_id"
            ]
          },
          {
            "required": [
              "id"
            ]
          }
        ]
      },
      "uniqueItems": true,
      "description": "Link to dosimetry records by submitter_id or UUID.",
      "minItems": 1,
      "maxItems": 1
    },
    "anatomic_targets": {
      "type": "array",
      "items": {
        "type": "object",
        "additionalProperties": false,
        "properties": {
          "submitter_id": {
            "type": "string",
            "minLength": 1
          },
          "id": {
            "pattern": "^[a-fA-F0-9]{8}-[a-fA-F0-9]{4}-[a-fA-F0-9]{4}-[a-fA-F0-9]{4}-[a-fA-F0-9]{12}$",
            "term": {
              "description": "A 128-bit identifier. Depending on the mechanism used to generate it, it is either guaranteed to be different from all other UUIDs/GUIDs generated until 3400 AD or extremely likely to be different. Its relatively small size lends itself well to sorting, ordering, and hashing of all sorts, storing in databases, simple allocation, and ease of programming in general.\n",
              "termDef": {
                "cde_id": "C54100",
                "cde_version": null,
                "source": "NCIt",
                "term": "Universally Unique Identifier",
                "term_url": "https://ncit.nci.nih.gov/ncitbrowser/ConceptReport.jsp?dictionary=NCI_Thesaurus&version=16.02d&ns=NCI_Thesaurus&code=C54100"
              }
            },
            "type": "string"
          }
        },
        "oneOf": [
          {
            "required": [
              "submitter_id"
            ]
          },
          {
            "required": [
              "id"
            ]
          }
        ]
      },
      "uniqueItems": true,
      "description": "Link to anatomic_target records by submitter_id or UUID.",
      "minItems": 1,
      "maxItems": 1
    },
    "provenance_records": {
      "type": "array",
      "items": {
        "type": "object",
        "additionalProperties": false,
        "properties": {
          "submitter_id": {
            "type": "string",
            "minLength": 1
          },
          "id": {
            "pattern": "^[a-fA-F0-9]{8}-[a-fA-F0-9]{4}-[a-fA-F0-9]{4}-[a-fA-F0-9]{4}-[a-fA-F0-9]{12}$",
            "term": {
              "description": "A 128-bit identifier. Depending on the mechanism used to generate it, it is either guaranteed to be different from all other UUIDs/GUIDs generated until 3400 AD or extremely likely to be different. Its relatively small size lends itself well to sorting, ordering, and hashing of all sorts, storing in databases, simple allocation, and ease of programming in general.\n",
              "termDef": {
                "cde_id": "C54100",
                "cde_version": null,
                "source": "NCIt",
                "term": "Universally Unique Identifier",
                "term_url": "https://ncit.nci.nih.gov/ncitbrowser/ConceptReport.jsp?dictionary=NCI_Thesaurus&version=16.02d&ns=NCI_Thesaurus&code=C54100"
              }
            },
            "type": "string"
          }
        },
        "oneOf": [
          {
            "required": [
              "submitter_id"
            ]
          },
          {
            "required": [
              "id"
            ]
          }
        ]
      },
      "uniqueItems": true,
      "description": "Link to provenance records by submitter_id or UUID."
    },
    "model_version": {
      "type": "string",
      "description": "Version of the submitting theranostics extension, independently of the MIDRC baseline version."
    },
    "record_status": {
      "type": "string",
      "description": "Record curation state, independent of clinical value.",
      "enum": [
        "draft",
        "reviewed",
        "approved",
        "superseded",
        "withdrawn"
      ]
    },
    "source_record_id": {
      "type": "string",
      "description": "Identifier of the originating source record; use an approved pseudonym when needed."
    },
    "source_system": {
      "type": "string",
      "description": "Source system or data provider."
    },
    "missing_properties": {
      "type": "array",
      "description": "Names of properties missing from this record; no missing value is encoded as zero.",
      "items": {
        "type": "string"
      }
    },
    "missing_reasons": {
      "type": "array",
      "description": "Reasons corresponding by index to missing_properties.",
      "items": {
        "enum": [
          "unknown",
          "not_collected",
          "not_applicable",
          "not_available",
          "withheld",
          "pending"
        ]
      }
    },
    "absorbed_dose_gy": {
      "type": "number",
      "description": "Absorbed dose for the linked target and run.",
      "minimum": 0
    },
    "statistic": {
      "type": "string",
      "description": "Dose statistic.",
      "enum": [
        "mean",
        "median",
        "maximum",
        "minimum",
        "d2",
        "d50",
        "d98",
        "other"
      ]
    },
    "uncertainty_gy": {
      "type": "number",
      "description": "Dose uncertainty with coverage definition.",
      "minimum": 0
    },
    "uncertainty_definition": {
      "type": "string",
      "description": "Standard deviation, confidence interval half-width or other uncertainty definition."
    },
    "target_mass_g": {
      "type": "number",
      "description": "Target mass used in dose calculation.",
      "minimum": 0
    },
    "uncertainty_percent": {
      "type": "number",
      "description": "Absorbed-dose uncertainty percent.",
      "minimum": 0
    },
    "uncertainty_coverage_probability": {
      "type": "number",
      "description": "Absorbed-dose uncertainty coverage probability.",
      "minimum": 0,
      "maximum": 1
    },
    "uncertainty_method": {
      "type": "string",
      "description": "Method and uncertainty convention; distinguishes standard, expanded and confidence/credible intervals."
    },
    "uncertainty_value": {
      "type": "number",
      "description": "Uncertainty magnitude; interpret with uncertainty_unit and uncertainty_definition.",
      "minimum": 0
    },
    "uncertainty_unit": {
      "type": "string",
      "description": "Unit of uncertainty magnitude.",
      "enum": [
        "Gy",
        "%"
      ]
    },
    "annotations": {
      "anyOf": [
        {
          "type": "object",
          "additionalProperties": false,
          "properties": {
            "submitter_id": {
              "type": "string",
              "minLength": 1
            },
            "id": {
              "pattern": "^[a-fA-F0-9]{8}-[a-fA-F0-9]{4}-[a-fA-F0-9]{4}-[a-fA-F0-9]{4}-[a-fA-F0-9]{12}$",
              "term": {
                "description": "A 128-bit identifier. Depending on the mechanism used to generate it, it is either guaranteed to be different from all other UUIDs/GUIDs generated until 3400 AD or extremely likely to be different. Its relatively small size lends itself well to sorting, ordering, and hashing of all sorts, storing in databases, simple allocation, and ease of programming in general.\n",
                "termDef": {
                  "cde_id": "C54100",
                  "cde_version": null,
                  "source": "NCIt",
                  "term": "Universally Unique Identifier",
                  "term_url": "https://ncit.nci.nih.gov/ncitbrowser/ConceptReport.jsp?dictionary=NCI_Thesaurus&version=16.02d&ns=NCI_Thesaurus&code=C54100"
                }
              },
              "type": "string"
            }
          },
          "anyOf": [
            {
              "required": [
                "submitter_id"
              ]
            },
            {
              "required": [
                "id"
              ]
            }
          ]
        },
        {
          "type": "array",
          "items": {
            "type": "object",
            "additionalProperties": false,
            "properties": {
              "submitter_id": {
                "type": "string",
                "minLength": 1
              },
              "id": {
                "pattern": "^[a-fA-F0-9]{8}-[a-fA-F0-9]{4}-[a-fA-F0-9]{4}-[a-fA-F0-9]{4}-[a-fA-F0-9]{12}$",
                "term": {
                  "description": "A 128-bit identifier. Depending on the mechanism used to generate it, it is either guaranteed to be different from all other UUIDs/GUIDs generated until 3400 AD or extremely likely to be different. Its relatively small size lends itself well to sorting, ordering, and hashing of all sorts, storing in databases, simple allocation, and ease of programming in general.\n",
                  "termDef": {
                    "cde_id": "C54100",
                    "cde_version": null,
                    "source": "NCIt",
                    "term": "Universally Unique Identifier",
                    "term_url": "https://ncit.nci.nih.gov/ncitbrowser/ConceptReport.jsp?dictionary=NCI_Thesaurus&version=16.02d&ns=NCI_Thesaurus&code=C54100"
                  }
                },
                "type": "string"
              }
            },
            "anyOf": [
              {
                "required": [
                  "submitter_id"
                ]
              },
              {
                "required": [
                  "id"
                ]
              }
            ]
          },
          "minItems": 1
        }
      ]
    }
  }
}
